Common English Name(s);Scientific Name & Authority;Family;Venom & Medical Significance;Global IUCN Red List Status;Description
Common Indian Krait;"Bungarus caeruleus (Schneider, 1801)";Elapidae;"Highly Venomous (Neurotoxic)";"Least Concern (LC)";"One of Sri Lanka's most dangerous snakes. Its venom is a powerful neurotoxin that can cause paralysis and respiratory failure. It is nocturnal, often found near human dwellings and water sources. Bites often occur at night when the snake is accidentally stepped on."
Green Vine Snake;"Ahaetulla nasuta (Lacepède, 1789)";Colubridae;"Mildly Venomous (Neurotoxic)";"Least Concern (LC)";"A slender, bright green snake known for its pointed snout. It is diurnal and arboreal, perfectly camouflaged in foliage. Its venom is not considered medically significant to humans, typically causing only localized swelling and mild pain."
Hump-nosed pit viper;"Hypnale hypnale (Merrem, 1820)";Viperidae;"Venomous (Hemotoxic)";"Least Concern (LC)";"The most common cause of venomous snakebites in Sri Lanka. While not typically lethal, its venom can cause severe pain, swelling, kidney damage, and blood clotting problems. It is a small, terrestrial viper, often found in leaf litter in plantations and gardens."
Indian Cobra;"Naja naja (Linnaeus, 1758)";Elapidae;"Highly Venomous (Neurotoxic & Cytotoxic)";"Least Concern (LC)";"Instantly recognizable by its famous hood, which it spreads when threatened. Its venom is a potent mix of neurotoxins and cytotoxins, causing paralysis and severe tissue damage. It is highly adaptable and found in various habitats, including populated areas."
Python;"Python molurus (Linnaeus, 1758)";Pythonidae;"Non-Venomous";"Near Threatened (NT)";"One of the largest snakes in the world. It is a non-venomous constrictor, killing its prey by suffocation. It primarily preys on mammals and birds. While not venomous, a bite can be severe due to its large, sharp teeth. It is often threatened by habitat loss and the skin trade."
Russell-s Viper;"Daboia russelii (Shaw & Nodder, 1797)";Viperidae;"Highly Venomous (Hemotoxic)";"Least Concern (LC)";"Considered one of the most dangerous snakes in Asia, responsible for many fatalities. Its hemotoxic venom causes extreme pain, massive swelling, blood clotting disorders, and acute kidney failure. It is a large, heavily built viper found in open, grassy areas and farmland."